Capability_key,Capability_desc,product,created_by,create_dt,update_by,update_dt,organization_name
None,None,,Praveen,2020-06-24 10:00:43.412443+00:00,Praveen,2020-06-24 10:00:43.412465+00:00,Digimonk
Capability-C1 (example),Capabilities are actions that a product can perform to meet the needs of the business or the marketplace and thus expressing business value.,,Praveen,2020-06-24 10:00:43.842817+00:00,Praveen,2020-06-24 10:00:43.842820+00:00,Digimonk
Capability-C2 (example),Enter a description in this field of what new or changed behaviors in the product you expect this capability to provide. Use a narrative story style or simply list the expected new functionality or features this capability will deliver when implemented.,,Praveen,2020-06-24 10:00:43.853850+00:00,Praveen,2020-06-24 10:00:43.853853+00:00,Digimonk
Phone ID Plus (example),Phone ID Plus provides the BestEverMortgage product new functionality for storing and retrieving customer data using the customer's phone number instead of the system assigned customer-id. This will improve the customer experience and is a major component of Product-P1's upgrade for this coming year.,,Praveen,2020-06-24 10:00:43.864756+00:00,Praveen,2020-06-24 10:00:43.864759+00:00,Digimonk
BestEverAPI Pilot (example),BestEverAPI pilot is rebuild of the current BestEver API to meet new Federal Reserve reporting rules for our business partners. This will allow the Finance Division to on-board new partners who will now not incur manual reporting costs.,,Praveen,2020-06-24 10:00:43.875673+00:00,Praveen,2020-06-24 10:00:43.875676+00:00,Digimonk
